### ISSUE TITLE
reduce number of dns requests to my.tado.com in one interval

### ISSUE THREAD

**Issue by 3x3cut0r** [DrozmotiX/ioBroker.tado#685]
In my pihole i can see that my RPi4 is sending up to 16 DNS requests to my.tado.com every 180 seconds.
Is it really necessary for the number of requests to be so high??
The interval can be set in the adapter itself and is set to 180 seconds, but this does not reduce the number of requests sent.

**Actual behavior**  
Every 180 seconds it sends up to 16 dns requests at once to my.tado.com.

**Expected behavior**  
Every 180 seconds it should send 1 dns request to my.tado.com.

**Versions:**  
 - Adapter version: 0.4.8
 - JS-Controller version: 5.0.12
 - Node version: 18.17.1
 - NPM version: 10.0.0
 - Operating system: Debian 11 bullseye

**Comment by HGlab01** [comment]
Thanks for sharing the observation!
Short google request shows me, that there is no out of the box solution for axios in place. I have to investigate how to cache dns requests...
Maybe you have a solution in place or know how to improve. If so, let me know or just create a PR.

**Comment by 3x3cut0r** [comment]
For now, I only have a workaround.
I have created a bash script and systemd service/timer to request my.tado.com every hour and set the result into /etc/hosts.   so my dns server (pihole) gets only one request every hour from my script. iobroker now can request as often as it wants.  
  
/opt/update_my.tado.com_dns.sh  
```
#!/bin/bash

# set domain
DOMAIN="my.tado.com"

# use dig to request my.tado.com
IP=$(dig +short $DOMAIN | head -n1)

# check if the IP is valid
if [[ $IP =~ ^[0-9]+\.[0-9]+\.[0-9]+\.[0-9]+$ ]]; then
    # remove entry from /etc/hosts if present
    sudo sed -i "/$DOMAIN/d" /etc/hosts

    # add ip and domain into /etc/hosts
    echo -e "$IP\t$DOMAIN" | sudo tee -a /etc/hosts
else
    echo "Ungültige IP-Adresse erhalten."
fi
```

/etc/systemd/system/update-tado-dns.service
```
Description=Update my.tado.com DNS in /etc/hosts

[Service]
Type=oneshot
ExecStart=/opt/update_my.tado.com_dns.sh
```

/etc/systemd/system/update-tado-dns.timer
```
[Unit]
Description=Run update-tado-dns.service every hour

[Timer]
OnBootSec=10min
OnUnitActiveSec=1h

[Install]
WantedBy=timers.target
```

but if i have time, i can do some more research in your code aswell

**Comment by HGlab01** [comment]
I will do some additional research as well.
Main issue is, that I use axios as lib (which is form my understanding a defacto standard) and axios does not support DNS caching and Node is not caching as well.
https://github.com/tcollinsworth/axios-cached-dns-resolve could be an option, but only works with ESM and not witch CJS

You could check a quick chance, maybe this solves it
DrozmotiX/ioBroker.tado#971a3175eb30604b5c9466ecb4df682206b2df15

![image](https://github.com/DrozmotiX/ioBroker.tado/assets/54232526/6dc893fb-6541-464c-be3a-d9b0048df52e)

**Comment by 3x3cut0r** [comment]
Sry, but no. Its been worse with 22 requests now :X

**Comment by HGlab01** [comment]
thanks for quick reply, will work on it ;-)

**Comment by 3x3cut0r** [comment]
i am not an expert, but could this help?
https://www.npmjs.com/package/axios-cached-dns-resolve

**Comment by HGlab01** [comment]
as mentioned https://github.com/DrozmotiX/ioBroker.tado/issues/685#issuecomment-1728355735

**Comment by HGlab01** [comment]
maybe v0.4.10-alpha.0 solves it

**Comment by 3x3cut0r** [comment]
sry but still the same:
![tado_version](https://github.com/DrozmotiX/ioBroker.tado/assets/1408580/348a8587-7a51-434b-8e39-4c97753cf5ef)
![pihole](https://github.com/DrozmotiX/ioBroker.tado/assets/1408580/0c463b2b-be12-42c0-971e-d774b9068c71)

**Comment by HGlab01** [comment]
I am absolut no network expert, but if I do this
`sudo tcpdump udp port 53`
and restart the tado adapter I get just a few lines and only one with "my.tado.con"
```
11:53:42.665543 IP ioBroker.60767 > dns.google.domain: 35522+ [1au] A? captive.g.aaplimg.com. (50)
11:53:42.666537 IP ioBroker.50268 > dns.google.domain: 62959+ [1au] PTR? 101.0.0.10.in-addr.arpa. (52)
11:53:42.671075 IP ioBroker.43896 > dns.opendns.com.domain: 1+ A? myip.opendns.com. (34)
11:53:42.676834 IP dns.google.domain > ioBroker.50268: 62959 NXDomain 0/0/1 (52)
11:53:42.676977 IP ioBroker.50268 > dns.google.domain: 62959+ PTR? 101.0.0.10.in-addr.arpa. (41)
11:53:42.686758 IP dns.google.domain > ioBroker.50268: 62959 NXDomain 0/0/0 (41)
11:53:42.688943 IP dns.opendns.com.domain > ioBroker.43896: 1 1/0/0 A 188.22.120.83 (50)
11:53:42.705942 IP dns.google.domain > ioBroker.60767: 35522 2/0/1 A 17.253.15.202, A 17.253.15.206 (82)
11:53:43.028397 IP ioBroker.44474 > dns.google.domain: 48929+ [1au] A? my.tado.com. (40)
11:53:43.039173 IP dns.google.domain > ioBroker.44474: 48929 2/0/1 A 108.128.98.184, A 99.80.197.58 (72)
```
From my understanding this means that there is only one time a dns resolve for my.tado.com?
Or is there another way to monitor DNS resolves?

**Comment by HGlab01** [comment]
I see...
I discuessed with Adapter dev team but there are not additional ideas how I can improve the adapter
From theoretical point of view the adapter opens a SSL connect and keeps it alive for all requests. Therefore onyl one resolve is needed.
No idea, why this keepalive is not working on your end. Maybe you can check your network?

Unfortunately I have on adapter side no additional ideas and the discussion on ibroker forum with most senior developers did not raise additional ideas.

**Comment by 3x3cut0r** [comment]
hmm ok
I thank you very much for your effort.
I do not have much time and will also be abroad for 3 months so i cannot go into it a little deeper this year.
for the moment i will continue using my workaround. this is a pretty stable one and i can live with it.

so i think then we can close this here, should we?

**Comment by HGlab01** [comment]
yes, let's close it but I am going to keep it in the back of my mind
