### ISSUE TITLE
Massiv viele Anfragen an my.tado.com

### ISSUE THREAD

**Issue by Trrw** [DrozmotiX/ioBroker.tado#383]
Vielen Dank für diesen tollen Adapter!

Ich habe Adguard Home an laufen. Dabei sind mir extrem viele Anfrage vom ioBroker aufgefallen die auf my.tado.com zugreifen. Quasi im Sekunden-Takt werden 5-15 Anfragen gesendet. Das aktuelle Abfrageintervall habe ich testweise von 30 Sekunden bereits auf 60 Sekunden in den Einstellungen des Adapters erhöht.

Wenn ich den Adapter stoppe, stoppen auch die extrem vielen Anfragen. Was hat es mit den Anfragen auf sich? Lassen sich diese evtl. reduzieren?

Danke
<img width="1145" alt="Bildschirmfoto 2021-11-04 um 21 34 16" src="https://user-images.githubusercontent.com/24519230/140416376-f8515237-59a1-4b04-88c4-c93f12c127a7.png">
!

**Comment by HGlab01** [comment]
Hallo,
im eingestellten Intervall werden ca. 15 oder mehr (wenn mehrere Geräte oder Räume wird es mehr) abgesetzt. Dann sollte Ruhe einkehren bis zum Erreichen des nächsten Intervalls. Das alle diese Requests innerhalb weniger Millisekunden oder Sekunden abgesetzt werden ist Absicht (um immer einen konsistenten Zustand zu haben). Die APP setzt auch diese große Anzahl an Requests ab.
Weniger Requests könnte man nur absetzen wenn man weniger Daten haben will.

**Comment by HGlab01** [comment]
Das sollte aber dann nicht sein, dass sich das in der Kürze wiederholt.
Starte bitte mal den Adapter im Debug-Modus und schau dir an, ob auch hier sich die Logs im wenigen Sekunden-Takt wiederholen oder im 60 Sekunden-Takt

**Comment by HGlab01** [comment]
Ich hab mir das nun auf meinem Server angesehen in dem ich tcpdump nutze (die IP Adresse ist die von my.tado.com):
`sudo tcpdump 'dst 54.77.37.248' -q`

Ergebnis:
```
sudo tcpdump 'dst 54.77.37.248' -q
tcpdump: verbose output suppressed, use -v or -vv for full protocol decode
listening on enp3s0, link-type EN10MB (Ethernet), capture size 262144 bytes
22:35:38.611212 IP ioBroker.60042 > ec2-54-77-37-248.eu-west-1.compute.amazonaws.com.https: tcp 0
22:35:38.658598 IP ioBroker.60042 > ec2-54-77-37-248.eu-west-1.compute.amazonaws.com.https: tcp 0
22:35:38.659186 IP ioBroker.60042 > ec2-54-77-37-248.eu-west-1.compute.amazonaws.com.https: tcp 557
22:35:38.707108 IP ioBroker.60042 > ec2-54-77-37-248.eu-west-1.compute.amazonaws.com.https: tcp 0
22:35:38.707495 IP ioBroker.60042 > ec2-54-77-37-248.eu-west-1.compute.amazonaws.com.https: tcp 0
22:35:38.708073 IP ioBroker.60042 > ec2-54-77-37-248.eu-west-1.compute.amazonaws.com.https: tcp 0
22:35:38.710631 IP ioBroker.60042 > ec2-54-77-37-248.eu-west-1.compute.amazonaws.com.https: tcp 126
22:35:38.992900 IP ioBroker.60048 > ec2-54-77-37-248.eu-west-1.compute.amazonaws.com.https: tcp 0
22:35:38.992954 IP ioBroker.60048 > ec2-54-77-37-248.eu-west-1.compute.amazonaws.com.https: tcp 0
22:35:38.994287 IP ioBroker.60048 > ec2-54-77-37-248.eu-west-1.compute.amazonaws.com.https: tcp 31
22:35:38.995846 IP ioBroker.60048 > ec2-54-77-37-248.eu-west-1.compute.amazonaws.com.https: tcp 0
22:35:38.996548 IP ioBroker.60046 > ec2-54-77-37-248.eu-west-1.compute.amazonaws.com.https: tcp 0
22:35:38.997022 IP ioBroker.60046 > ec2-54-77-37-248.eu-west-1.compute.amazonaws.com.https: tcp 0
22:35:38.998214 IP ioBroker.60046 > ec2-54-77-37-248.eu-west-1.compute.amazonaws.com.https: tcp 31
22:35:38.999792 IP ioBroker.60046 > ec2-54-77-37-248.eu-west-1.compute.amazonaws.com.https: tcp 0
22:35:39.001318 IP ioBroker.60050 > ec2-54-77-37-248.eu-west-1.compute.amazonaws.com.https: tcp 0
22:35:39.001452 IP ioBroker.60050 > ec2-54-77-37-248.eu-west-1.compute.amazonaws.com.https: tcp 0
22:35:39.003032 IP ioBroker.60050 > ec2-54-77-37-248.eu-west-1.compute.amazonaws.com.https: tcp 31
22:35:39.015242 IP ioBroker.60050 > ec2-54-77-37-248.eu-west-1.compute.amazonaws.com.https: tcp 0
22:35:39.016068 IP ioBroker.60054 > ec2-54-77-37-248.eu-west-1.compute.amazonaws.com.https: tcp 0
22:35:39.063813 IP ioBroker.60054 > ec2-54-77-37-248.eu-west-1.compute.amazonaws.com.https: tcp 0
22:35:39.064376 IP ioBroker.60054 > ec2-54-77-37-248.eu-west-1.compute.amazonaws.com.https: tcp 557
22:35:39.112533 IP ioBroker.60054 > ec2-54-77-37-248.eu-west-1.compute.amazonaws.com.https: tcp 0
22:35:39.113490 IP ioBroker.60054 > ec2-54-77-37-248.eu-west-1.compute.amazonaws.com.https: tcp 1165
22:35:39.168655 IP ioBroker.60054 > ec2-54-77-37-248.eu-west-1.compute.amazonaws.com.https: tcp 0
22:35:39.170290 IP ioBroker.60054 > ec2-54-77-37-248.eu-west-1.compute.amazonaws.com.https: tcp 31
22:35:39.176276 IP ioBroker.60054 > ec2-54-77-37-248.eu-west-1.compute.amazonaws.com.https: tcp 0
22:35:39.176960 IP ioBroker.60058 > ec2-54-77-37-248.eu-west-1.compute.amazonaws.com.https: tcp 0
22:35:39.224205 IP ioBroker.60058 > ec2-54-77-37-248.eu-west-1.compute.amazonaws.com.https: tcp 0
22:35:39.224639 IP ioBroker.60058 > ec2-54-77-37-248.eu-west-1.compute.amazonaws.com.https: tcp 557
22:35:39.272289 IP ioBroker.60058 > ec2-54-77-37-248.eu-west-1.compute.amazonaws.com.https: tcp 0
22:35:39.273091 IP ioBroker.60058 > ec2-54-77-37-248.eu-west-1.compute.amazonaws.com.https: tcp 1172
22:35:39.329435 IP ioBroker.60058 > ec2-54-77-37-248.eu-west-1.compute.amazonaws.com.https: tcp 0
22:35:39.329488 IP ioBroker.60058 > ec2-54-77-37-248.eu-west-1.compute.amazonaws.com.https: tcp 0
22:35:39.330801 IP ioBroker.60058 > ec2-54-77-37-248.eu-west-1.compute.amazonaws.com.https: tcp 31
22:35:39.335972 IP ioBroker.60058 > ec2-54-77-37-248.eu-west-1.compute.amazonaws.com.https: tcp 0
22:35:39.336447 IP ioBroker.60060 > ec2-54-77-37-248.eu-west-1.compute.amazonaws.com.https: tcp 0
22:35:39.382732 IP ioBroker.60060 > ec2-54-77-37-248.eu-west-1.compute.amazonaws.com.https: tcp 0
22:35:39.383458 IP ioBroker.60060 > ec2-54-77-37-248.eu-west-1.compute.amazonaws.com.https: tcp 557
22:35:39.429817 IP ioBroker.60060 > ec2-54-77-37-248.eu-west-1.compute.amazonaws.com.https: tcp 0
22:35:39.430237 IP ioBroker.60060 > ec2-54-77-37-248.eu-west-1.compute.amazonaws.com.https: tcp 1153
22:35:39.490704 IP ioBroker.60060 > ec2-54-77-37-248.eu-west-1.compute.amazonaws.com.https: tcp 0
22:35:39.491698 IP ioBroker.60060 > ec2-54-77-37-248.eu-west-1.compute.amazonaws.com.https: tcp 31
22:35:39.500009 IP ioBroker.60060 > ec2-54-77-37-248.eu-west-1.compute.amazonaws.com.https: tcp 0
22:35:39.500200 IP ioBroker.60062 > ec2-54-77-37-248.eu-west-1.compute.amazonaws.com.https: tcp 0
22:35:39.545983 IP ioBroker.60062 > ec2-54-77-37-248.eu-west-1.compute.amazonaws.com.https: tcp 0
22:35:39.546377 IP ioBroker.60062 > ec2-54-77-37-248.eu-west-1.compute.amazonaws.com.https: tcp 557
22:35:39.592961 IP ioBroker.60062 > ec2-54-77-37-248.eu-west-1.compute.amazonaws.com.https: tcp 0
22:35:39.593697 IP ioBroker.60062 > ec2-54-77-37-248.eu-west-1.compute.amazonaws.com.https: tcp 1165
22:35:39.646177 IP ioBroker.60062 > ec2-54-77-37-248.eu-west-1.compute.amazonaws.com.https: tcp 0
22:35:39.646225 IP ioBroker.60062 > ec2-54-77-37-248.eu-west-1.compute.amazonaws.com.https: tcp 0
22:35:39.647447 IP ioBroker.60062 > ec2-54-77-37-248.eu-west-1.compute.amazonaws.com.https: tcp 31
22:35:39.652631 IP ioBroker.60062 > ec2-54-77-37-248.eu-west-1.compute.amazonaws.com.https: tcp 0
22:35:39.653021 IP ioBroker.60064 > ec2-54-77-37-248.eu-west-1.compute.amazonaws.com.https: tcp 0
22:35:39.700364 IP ioBroker.60064 > ec2-54-77-37-248.eu-west-1.compute.amazonaws.com.https: tcp 0
22:35:39.701017 IP ioBroker.60064 > ec2-54-77-37-248.eu-west-1.compute.amazonaws.com.https: tcp 557
22:35:39.748386 IP ioBroker.60064 > ec2-54-77-37-248.eu-west-1.compute.amazonaws.com.https: tcp 0
22:35:39.749195 IP ioBroker.60064 > ec2-54-77-37-248.eu-west-1.compute.amazonaws.com.https: tcp 1172
22:35:39.802189 IP ioBroker.60064 > ec2-54-77-37-248.eu-west-1.compute.amazonaws.com.https: tcp 0
22:35:39.802246 IP ioBroker.60064 > ec2-54-77-37-248.eu-west-1.compute.amazonaws.com.https: tcp 0
22:35:39.803535 IP ioBroker.60064 > ec2-54-77-37-248.eu-west-1.compute.amazonaws.com.https: tcp 31
22:35:39.808547 IP ioBroker.60064 > ec2-54-77-37-248.eu-west-1.compute.amazonaws.com.https: tcp 0
22:35:39.809330 IP ioBroker.60066 > ec2-54-77-37-248.eu-west-1.compute.amazonaws.com.https: tcp 0
22:35:39.857317 IP ioBroker.60066 > ec2-54-77-37-248.eu-west-1.compute.amazonaws.com.https: tcp 0
22:35:39.858123 IP ioBroker.60066 > ec2-54-77-37-248.eu-west-1.compute.amazonaws.com.https: tcp 557
22:35:39.906131 IP ioBroker.60066 > ec2-54-77-37-248.eu-west-1.compute.amazonaws.com.https: tcp 0
22:35:39.907012 IP ioBroker.60066 > ec2-54-77-37-248.eu-west-1.compute.amazonaws.com.https: tcp 1147
22:35:39.962939 IP ioBroker.60066 > ec2-54-77-37-248.eu-west-1.compute.amazonaws.com.https: tcp 0
22:35:39.962991 IP ioBroker.60066 > ec2-54-77-37-248.eu-west-1.compute.amazonaws.com.https: tcp 0
22:35:39.964287 IP ioBroker.60066 > ec2-54-77-37-248.eu-west-1.compute.amazonaws.com.https: tcp 31
22:35:39.976722 IP ioBroker.60066 > ec2-54-77-37-248.eu-west-1.compute.amazonaws.com.https: tcp 0
22:35:39.977178 IP ioBroker.60068 > ec2-54-77-37-248.eu-west-1.compute.amazonaws.com.https: tcp 0
22:35:40.023032 IP ioBroker.60068 > ec2-54-77-37-248.eu-west-1.compute.amazonaws.com.https: tcp 0
22:35:40.023616 IP ioBroker.60068 > ec2-54-77-37-248.eu-west-1.compute.amazonaws.com.https: tcp 557
22:35:40.069663 IP ioBroker.60068 > ec2-54-77-37-248.eu-west-1.compute.amazonaws.com.https: tcp 0
22:35:40.070581 IP ioBroker.60068 > ec2-54-77-37-248.eu-west-1.compute.amazonaws.com.https: tcp 1145
22:35:40.120669 IP ioBroker.60068 > ec2-54-77-37-248.eu-west-1.compute.amazonaws.com.https: tcp 0
22:35:40.120960 IP ioBroker.60068 > ec2-54-77-37-248.eu-west-1.compute.amazonaws.com.https: tcp 0
22:35:40.122204 IP ioBroker.60068 > ec2-54-77-37-248.eu-west-1.compute.amazonaws.com.https: tcp 31
22:35:40.124058 IP ioBroker.60068 > ec2-54-77-37-248.eu-west-1.compute.amazonaws.com.https: tcp 0
22:36:40.998586 IP ioBroker.60238 > ec2-54-77-37-248.eu-west-1.compute.amazonaws.com.https: tcp 0
22:36:41.043679 IP ioBroker.60238 > ec2-54-77-37-248.eu-west-1.compute.amazonaws.com.https: tcp 0
22:36:41.044443 IP ioBroker.60238 > ec2-54-77-37-248.eu-west-1.compute.amazonaws.com.https: tcp 557
22:36:41.089948 IP ioBroker.60238 > ec2-54-77-37-248.eu-west-1.compute.amazonaws.com.https: tcp 0
22:36:41.090811 IP ioBroker.60238 > ec2-54-77-37-248.eu-west-1.compute.amazonaws.com.https: tcp 1153
22:36:41.149985 IP ioBroker.60238 > ec2-54-77-37-248.eu-west-1.compute.amazonaws.com.https: tcp 0
22:36:41.150027 IP ioBroker.60238 > ec2-54-77-37-248.eu-west-1.compute.amazonaws.com.https: tcp 0
22:36:41.151353 IP ioBroker.60238 > ec2-54-77-37-248.eu-west-1.compute.amazonaws.com.https: tcp 31
22:36:41.167319 IP ioBroker.60238 > ec2-54-77-37-248.eu-west-1.compute.amazonaws.com.https: tcp 0
```
Da sieht man schön das ein großer Block abgesetzt wird, dann ist 60 Sekunden komplette Ruhe und dann kommt wieder ein Schwung - so sollte es ca. sein
